{
  "checkpoint_backend": "sqlite",
  "completed_at": null,
  "completed_target_identities": [
    {
      "delta": 0,
      "existing_alt": "",
      "field_name": "field_image",
      "file_uuid": "07af2dce-7bfd-5de6-b291-e090669eda25",
      "node_uuid": "344eb273-ac74-5be8-85fb-6c2efd1f93a6",
      "revision_id": 1,
      "schema_version": 1,
      "sequence": 1,
      "target_state": "missing"
    }
  ],
  "continuation_boundary_armed": false,
  "continuation_boundary_reached": false,
  "framework_origin": "langgraph",
  "gate2c_failure_injection_fired": false,
  "interrupted_at": "2026-08-10T15:57:39.146630Z",
  "model_id": "gpt-4.1-mini-2025-04-14",
  "next_target_index": 1,
  "prompt_version": "langgraph-alt-text-v1.0.0",
  "recommendation_ids": [
    {
      "node_id": 21,
      "revision_id": 21,
      "sequence": 1,
      "uuid": "bfbe1bd5-738f-45b9-a9db-0c989c379f77"
    }
  ],
  "resumed_at": "2026-08-10T16:04:05.030702Z",
  "run_id": "langgraph-20260810T155626Z-002654f7",
  "schema_version": 1,
  "started_at": "2026-08-10T15:57:35.768375Z",
  "status": "running",
  "target_sequence_hash": "sha256:1f6132da02069f825cde52500242350e9ad6e85537c6c5407677e82d0e653728",
  "thread_id": "langgraph-20260810T155626Z-002654f7",
  "updated_at": "2026-08-10T16:04:05.756221Z",
  "validation_results": [
    {
      "deterministic_validation_passed": true,
      "errors": [],
      "sequence": 1,
      "structured_output_schema_valid": true,
      "target": {
        "delta": 0,
        "existing_alt": "",
        "field_name": "field_image",
        "file_uuid": "07af2dce-7bfd-5de6-b291-e090669eda25",
        "node_uuid": "344eb273-ac74-5be8-85fb-6c2efd1f93a6",
        "revision_id": 1,
        "schema_version": 1,
        "sequence": 1,
        "target_state": "missing"
      }
    }
  ]
}
